start_pos,n_gram_size,word,vicinity,neighbour,context,level,source_file
427010,5,закон,бппро_ЗАКОН_гнпвг,про,"золота Америке? ""Колосс оказался на глиняных н",word,rus_fiction_tolstoy-a-n_giperboloid-inzhenera-garina_1927_scifi.txt
224266,5,прошу,еэтзо_ПРОШУ_шлоно,шло,"   Перелезть через стену можно было, лишь подставив с той стороны лестницу. Улички, граничившие с больницей, были тихие и пустынные, все же фонари там горели настолько ярко и так часто слышались в тишине за стеной шаги полицейских, что вопрос о лестнице отпадал.
   Разумеется, не будь битого стекла на стене, ловкий человек перемахнул бы и без лестницы. Каждое утро Шельга из-за шторы осматривал всю стену до последнего камешка. Опасность грозила только с этой стороны. Человек, посланный Роллингом, вряд ли рискнул бы появиться изнутри гостиницы. Но что убийца так или иначе появится, Шельга не сомневался.
   Он ждал теперь осмотра врача, чтобы выписаться. Об этом было известно. Врач приезжал обычно пять раз в неделю. На этот раз оказалось, что врач заболел. Шельге заявили, что без осмотра старшего врача его не выпишут. Протестовать он даже и не пытался. Он дал знать в советское посольство, чтобы оттуда ему доставляли еду. Больничный суп он выливал в раковину, хлеб бросал дроздам.
   Шельга знал, что Роллинг должен избавиться от единственного свидетеля. Шельга теперь почти не спал, -- так велико было возбуждение. Сестра-кармелитка приносила ему газеты, -- весь день он работал ножницами и изучал вырезки. Хлынову он запретил приходить в больницу. (Вольф был в Германии, на Рейне, где собирал сведения о борьбе Роллинга с Германской анилиновой компанией.)
   Утром, подойдя, как обычно, к окну, Шельга оглядел сад и сейчас же отступил за занавес. Ему стало даже весело. Наконец-то! В саду, с северной стороны, полускрытая липой, к стене была прислонена лестница садовника, верхний конец ее торчал на пол-аршина над осколками стекла.
   Шельга ",paragraph,rus_fiction_tolstoy-a-n_giperboloid-inzhenera-garina_1927_scifi.txt
