start_pos,n_gram_size,word,vicinity,neighbour,context,level,source_file
355942,5,пункт,усвас_ПУНКТ_псвбп,вас,"поезд уйдет, носильщик куда-то пропал с в",word,rus_fiction_kaverin_skandalist_1928_roman.txt
134351,5,ловко,иуимб_ЛОВКО_попсн,поп," Литература?

Он больше не мог обманывать себя, ему уже не помогала ирония — она была разбита наголову, обращена в бегство этим молчаливым, почти торжественным, милым часом с притушенной лампой, с подступающим сном, с усталостью на лицах друзей.

В руках у него была любовь, и он не знал, что ему делать с ней.


3

Криличевский, который и по ночам не забывал о своих топливных обязанностях, с грохотом обрушил дрова на маленькую корявую печку.

Он ворвался в комнату холодный, веселый, в желтом романовском полушубке. Полушубок",sentence,rus_fiction_kaverin_skandalist_1928_roman.txt
