start_pos,n_gram_size,word,vicinity,neighbour,context,level,source_file
156052,5,ровно,тчсем_РОВНО_сивво,сем,"рост. Она вскрикнула, но очень слабо, и в",word,dostoevsky_prestuplenie_i_nakazanie.txt
247121,5,новое,рпвел_НОВОЕ_птмеч,вел,"надежда осуществить векселек? Ответ: есть, потому так",word,dostoevsky_prestuplenie_i_nakazanie.txt
633281,5,споре,бмдоп_СПОРЕ_притт,при,сих пор останавливать решимость ее покончить ,word,dostoevsky_prestuplenie_i_nakazanie.txt
1064591,5,новое,уяспи_НОВОЕ_внпмр,спи,"некоторых облегчающих вину обстоятельств.
   Еще в начале п",word,dostoevsky_prestuplenie_i_nakazanie.txt
1073840,5,скрип,иикое_СКРИП_епчос,кое,сообщает каждый раз из получаемых ею писем; ,word,dostoevsky_prestuplenie_i_nakazanie.txt
